Function Name,State Variables Modified,Can Transfer Ether
WorldBetToken(),"countryIsPlaying, countryIsPlaying, countryIsPlaying, countryIsPlaying, countryIsPlaying, countryIsPlaying, countryIsPlaying, countryIsPlaying, countryIsPlaying, countryIsPlaying, countryIsPlaying, countryIsPlaying, countryIsPlaying, countryIsPlaying, countryIsPlaying, countryIsPlaying, countryIsPlaying, countryIsPlaying, countryIsPlaying, countryIsPlaying, countryIsPlaying, countryIsPlaying, countryIsPlaying, countryIsPlaying, countryIsPlaying, countryIsPlaying, countryIsPlaying, countryIsPlaying, countryIsPlaying, countryIsPlaying, countryIsPlaying, countryIsPlaying",True
"giveBalance(uint,uint,uint)","countryIsPlaying, WINNER_COUNTRY_CODE, userBalanceOf, countries, users, userBalanceOf, jackpotUsers, jackpotUsers, totalSupply",False
installWinner(uint),"WINNER_COUNTRY_CODE, countryIsPlaying, WINNER_COUNTRY_CODE, WINNER_COUNTRY_CODE",False
removeCountry(uint),countryIsPlaying,False
playJackpot(),"JACKPOT_WINNER, jackpotUsers, jackpotUsers, jackpotUsers, JACKPOT_WINNER, jackpotUsers, JACKPOT_WINNER, jackpotUsers",False
winnerList(),"countries, WINNER_COUNTRY_CODE",False
