Function Name,State Variables Modified,Can Transfer Ether
setDescription(string),description,False
setInstructions(string),instructions,False
"constructor(uint,string,uint,address)","owner, price, description, timestampEnd, beneficiary",True
"function()publicpayable{if(msg.value==0){refund();return;}require(now<timestampEnd,""auction has ended"");if(bids[msg.sender]>0){bids[msg.sender]+=msg.value;}else{bids[msg.sender]=msg.value;accountsList.push(msg.sender);}if(initialPrice){require(bids[msg.sender]>=price,""bid too low, minimum is the initial price"");}else{require(bids[msg.sender]>=(price*5/4),""bid too low, minimum 25% increment"");}if(now>timestampEnd-increaseTimeIfBidBeforeEnd){timestampEnd=now+increaseTimeBy;}initialPrice=false;price=bids[msg.sender];winner=msg.sender;emitBid(winner,price,now);}()","timestampEnd, bids, bids, bids, accountsList, initialPrice, bids, price, bids, price, timestampEnd, increaseTimeIfBidBeforeEnd, timestampEnd, increaseTimeBy, initialPrice, price, bids, winner, winner, price",True
finalize(),"finalized, initialPrice, finalized, beneficiary, price, bids, winner, accountsList, bids, accountsList, accountsList, bids, accountsList, bids, accountsList",True
refund(),"winner, bids, bids, bids",True
