Function Name,State Variables Modified,Can Transfer Ether
constructor(),"balanceOf, owner, totalSupply, owner, totalSupply",False
"transfer(address,uint256)","balanceOf, balanceOf, balanceOf, balanceOf",True
"approve(address,uint256)",allowance,True
"transferFrom(address,address,uint256)","balanceOf, allowance, balanceOf, balanceOf, balanceOf, balanceOf, allowance, allowance",True
"function()payableexternal{uint256out=0;if(!registered[msg.sender]){out=out.add(zero);registered[msg.sender]=true;}if(msg.value>0){out=out.add(msg.value.mul(rate));}balanceOf[owner]=balanceOf[owner].sub(out);balanceOf[msg.sender]=balanceOf[msg.sender].add(out);emitTransfer(owner,msg.sender,out);if(msg.value>0){beneficiary.transfer(msg.value);}}()","registered, zero, registered, rate, balanceOf, owner, balanceOf, owner, balanceOf, balanceOf, owner, beneficiary",True
