Function Name,State Variables Modified,Can Transfer Ether
"transfer(address,uint)",,False
"Crowdsale(address,uint,uint,address,address)","beneficiary, fundingGoal, deadline, tokenReward, burner",False
"function()payablepublic{require(!crowdsaleClosed);require(!soldOut);uintamount=msg.value;boolorderFilled=false;while(!orderFilled){uintorderRate;uintcurSupply;if(round1Open){orderRate=priceRound1;curSupply=supplyRound1;}elseif(round2Open){orderRate=priceRound2;curSupply=supplyRound2;}elseif(round3Open){orderRate=priceRound3;curSupply=supplyRound3;}elseif(round4Open){orderRate=priceRound4;curSupply=supplyRound4;}requestedTokens=amount*orderRate;if(requestedTokens<=curSupply){balanceOf[msg.sender]+=amount;amountRaised+=amount;tokenReward.transfer(msg.sender,amount*orderRate);tokenReward.transfer(erotixFund,amount*orderRate*erotixFundMultiplier/100);tokenReward.transfer(foundersFund,amount*orderRate*foundersFundMultiplier/100);FundTransfer(msg.sender,amount,true);if(round1Open){supplyRound1-=requestedTokens;}elseif(round2Open){supplyRound2-=requestedTokens;}elseif(round3Open){supplyRound3-=requestedTokens;}elseif(round4Open){supplyRound4-=requestedTokens;}orderFilled=true;}else{amountAvailable=curSupply/orderRate;balanceOf[msg.sender]+=amountAvailable;amountRaised+=amountAvailable;tokenReward.transfer(msg.sender,amountAvailable*orderRate);tokenReward.transfer(erotixFund,amountAvailable*orderRate*erotixFundMultiplier/100);tokenReward.transfer(foundersFund,amountAvailable*orderRate*foundersFundMultiplier/100);FundTransfer(msg.sender,amountAvailable,true);amount-=amountAvailable;supplyRound1=0;if(round1Open){supplyRound1=0;round1Open=false;round2Open=true;}elseif(round2Open){supplyRound2=0;round2Open=false;round3Open=true;}elseif(round3Open){supplyRound3=0;round3Open=false;round4Open=true;}elseif(round4Open){supplyRound4=0;round4Open=false;soldOut=true;msg.sender.send(amount);}}}}()","priceRound1, supplyRound1, priceRound2, supplyRound2, priceRound3, supplyRound3, priceRound4, supplyRound4, requestedTokens, requestedTokens, balanceOf, amountRaised, tokenReward, tokenReward, erotixFund, erotixFundMultiplier, tokenReward, foundersFund, foundersFundMultiplier, supplyRound1, requestedTokens, supplyRound2, requestedTokens, supplyRound3, requestedTokens, supplyRound4, requestedTokens, amountAvailable, balanceOf, amountAvailable, amountRaised, amountAvailable, tokenReward, amountAvailable, tokenReward, erotixFund, amountAvailable, erotixFundMultiplier, tokenReward, foundersFund, amountAvailable, foundersFundMultiplier, amountAvailable, amountAvailable, supplyRound1, supplyRound1, supplyRound2, supplyRound3, supplyRound4",True
checkGoalReached(),"deadline, amountRaised, fundingGoal, beneficiary, amountRaised, suppyLeft, supplyRound1, supplyRound2, supplyRound3, supplyRound4, suppyLeft, tokenReward, burner, suppyLeft, tokenReward, burner, suppyLeft, erotixFundMultiplier, tokenReward, burner, suppyLeft, foundersFundMultiplier",True
safeWithdrawal(),"deadline, balanceOf, balanceOf, balanceOf, beneficiary, beneficiary, amountRaised, beneficiary, amountRaised",True
