Function Name,State Variables Modified,Can Transfer Ether
assignPersiansToBattle(uint),"persians, MAX_PERSIANS, BTL_PERSIAN, persians, WAD",True
assignImmortalsToBattle(uint),"immortals, MAX_IMMORTALS, WAD, BTL_IMMORTAL, immortals, BP_IMMORTAL",True
assignSpartansToBattle(uint),"spartans, MAX_SPARTANS, BTL_SPARTAN, spartans, WAD, BP_SPARTAN",True
assignAtheniansToBattle(uint),"athenians, MAX_ATHENIANS, BTL_ATHENIAN, athenians, WAD, BP_ATHENIAN",True
redeemWarriors(),"spartans, spartans, persians, BATTLE_CASUALTIES, persians, persians, spartans, BATTLE_CASUALTIES, persians, BATTLE_CASUALTIES, spartans, BATTLE_CASUALTIES, immortals, athenians",True
