Function Name,State Variables Modified,Can Transfer Ether
constructor(),"admin_, contractWhitelist",True
addGame(uint256),"feeAmount_, feeAmount_, gameTicketWei_, player_, leve1Rewards_, gameTicketWei_, player_, playAff_, player_, player_, playAff_, leve2Rewards_, gameTicketWei_, player_, player_, player_, playAddr_, admin_, player_, playAddr_, admin_",False
withdraw(uint256),"playAddr_, player_, player_, gameTicketWei_, player_, player_, player_",True
getShareAff(uint256),"playAddr_, playAff_, playAff_, player_, player_, player_, playAff_, player_, player_, player_",True
getOtherGameAff(),"otherGameAff_, player_, playAff_, player_, player_",True
"addOtherGameAff(uint256,address,address,address)","contractWhite, player_, playAff_, player_, otherGameAff_, otherGameAff_",True
"updateCW(address,uint8)","admin_, contractWhite, contractWhitelist, contractWhite, contractWhitelist, contractWhitelist, contractWhite, contractWhite",True
closeGame(),"admin_, admin_",True
getCwList(),"admin_, contractWhitelist",True
