Function Name,State Variables Modified,Can Transfer Ether
constructor(address),"teamAddress, keyPrice, keyAddress, durationPhaseArray, durationPhaseIndex, duration, durationPhaseArray, durationPhaseIndex, currentGeneration",True
setName(string),"players, teamAddress, teamNamingIncome, players",True
referralName(string),"players, players, players",True
referralPay(uint),"participants, players, players, players",True
function()isHuman()payablepublic{uint256amount=msg.value;deposit(amount);}(),,False
"depositVault(uint,uint)","keyLocked, keyLocked, keyPrice, players, players, players, participants, players, players, players, keyLocked",True
safeWithdrawal(),"players, players, keyLocked, keyLocked, poolWithdraw, players, keyLocked",True
helpWithdrawal(address),"teamAddress, players, players, keyLocked, keyLocked, poolWithdraw, players, players, teamAddress, keyLocked",True
