Function Name,State Variables Modified,Can Transfer Ether
"ICO(string,,uint256)","creator, beneficiary, campaignUrl, tokenReward, ICOdeadline, startTime, creator, beneficiary, campaignUrl, ICOdeadline",True
contribute(),"totalRaised, totalRaised, price, totalDistributed, totalDistributed, beneficiary, tokenReward, totalRaised",True
checkIfFundingCompleteOrExpired(),"ICOdeadline, state, state, closedAt, totalRaised",False
finished(),"state, beneficiary, tokenReward, tokenReward, beneficiary, beneficiary",True
function()publicpayable{contribute();}(),,False
