Function Name,State Variables Modified,Can Transfer Ether
"ekkoBlock1(uint256,string,uint8,string)","balanceOf, totalSupply, name, symbol, decimals, owner",True
"transfer(address,uint256)","balanceOf, balanceOf, balanceOf, balanceOf, balanceOf, balanceOf, balanceOf",True
"transferFrom(address,address,uint256)","balanceOf, balanceOf, balanceOf, allowance, balanceOf, balanceOf, balanceOf, balanceOf, allowance, allowance",True
"freeze(address,uint256)","owner, balanceOf, balanceOf, balanceOf, freezeOf, freezeOf",True
"unfreeze(address,uint256)","owner, freezeOf, freezeOf, freezeOf, balanceOf, balanceOf",True
