Function Name,State Variables Modified,Can Transfer Ether
function()payablepublic{require(msg.data.length==0);buy();}(),,False
buy(),"finished, saleStartTime, saleStartTime, saleDuration, minimumInvestment, saleCap, totalInvested, investors, saleStartTime, TRIPLE_BONUS, saleStartTime, DOUBLE_BONUS, saleStartTime, SINGLE_BONUS, totalInvested, totalInvested, finished, finalPrice, finalPrice",True
buyReferral(address),"investors, investors",True
outstandingTokens(address),"finished, finalPrice, investors, finalPrice",False
deliver(address),"finished, investors, token, centralBank, totalInvested, totalInvested",True
collectRevenue(),"centralBank, centralBank",True
price(uint256),"saleStartTime, saleStartTime, saleDuration, TWO128_1, c, c, c, b, a",False
finishSale(),"centralBank, finished, saleStartTime, saleDuration, finished, finalPrice, finalPrice",True
destroy(),"centralBank, finished, saleStartTime, saleDuration, totalInvested, centralBank",True
