Function Name,State Variables Modified,Can Transfer Ether
"transfer(address,uint)",,False
balanceOf(address),,False
"Crowdsale(address,uint,address,address)","beneficiary, deadline, tokenReward, tokenSource",False
"function()publicpayable{uintbase=1000000000000000000;uintamount=msg.value;uinttokenBalance=tokenReward.balanceOf(this);uintnum=10*tokenSource.balanceOf(msg.sender)*base;balanceOf[msg.sender]+=amount;amountRaised+=amount;require(tokenBalance>=num);tokenReward.transfer(msg.sender,num);beneficiary.transfer(msg.value);FundTransfer(msg.sender,amount,true);}()","tokenReward, tokenSource, balanceOf, amountRaised, tokenReward, beneficiary",True
safeWithdrawal(),"beneficiary, tokenReward, tokenReward, beneficiary",True
