Function Name,State Variables Modified,Can Transfer Ether
constructor(),"isVoter, voters",True
"newProposal(address,bytes)","proposals, proposals, proposals, allProposals",False
"vote(bytes32,bool)","proposals, proposals, voters, proposals, proposals, proposals, proposals, proposals, proposals, voters, proposals, voters, proposals, voters, proposals, proposals, proposals, voters, proposals, voters",True
addVoter(address),"isVoter, isVoter, voters, voters",False
delVoter(address),"isVoter, isVoter, voters, voters",True
